ID_Produto,Produto,Titulo,Categoria,Descricao,Preco,Avaliacao,Disponibilidade
1,Livro,A Light in the Attic,poetry,It's hard to imagine a world without a light in the attic. this now-classic collection of poetry and drawings from shel silverstein celebrates its 20th anniversary with this special edition. silverstein's humorous and creative verse can amuse the dowdiest of readers. lemon-faced adults and fidgety kids sit still and read these rhythmic words and laugh and smile and love th it's hard to imagine a world without a light in the attic. this now-classic collection of poetry and drawings from shel silverstein.,51.77,3,In stock
2,Livro,Tipping the Velvet,historical fiction,"""erotic and absorbing...written with starling power.""--""the new york times book review "" nan king, an oyster girl, is captivated by the music hall phenomenon kitty butler, a male impersonator extraordinaire treading the boards in canterbury. through a friend at the box office, nan manages to visit all her shows and finally meet her heroine. soon after, she becomes kitty's ""erotic and absorbing...written with starling power.""--""the new york times book review "" nan king, an oyster girl, is captivated by the music hall.",53.74,1,In stock
3,Livro,Soumission,fiction,"Dans une france assez proche de la nôtre, un homme s’engage dans la carrière universitaire. peu motivé par l’enseignement, il s’attend à une vie ennuyeuse mais calme, protégée des grands drames historiques. cependant les forces en jeu dans le pays ont fissuré le système politique jusqu’à provoquer son effondrement. cette implosion sans soubresauts, sans vraie révolution, s dans une france assez proche de la nôtre, un homme s’engage dans la carrière universitaire. peu motivé par l’enseignement, il s’attend à une vie.",50.1,1,In stock
4,Livro,Sharp Objects,mystery,"Wicked above her hipbone, girl across her heart words are like a road map to reporter camille preaker’s troubled past. fresh from a brief stay at a psych hospital, camille’s first assignment from the second-rate daily paper where she works brings her reluctantly back to her hometown to cover the murders of two preteen girls. nasty on her kneecap, babydoll on her leg since wicked above her hipbone, girl across her heart words are like a road map to reporter camille preaker’s troubled past. fresh from a brief stay at a psych hospital, camille’s first assignment from the second-rate daily paper where she works brings her reluctantly back to her hometown to cover the murders of two preteen girls. nasty on her kneecap, babydoll on her leg since she left town eight years ago, camille has hardly.",47.82,4,In stock
5,Livro,Sapiens: A Brief History of Humankind,history,"From a renowned historian comes a groundbreaking narrative of humanity’s creation and evolution—a #1 international bestseller—that explores the ways in which biology and history have defined us and enhanced our understanding of what it means to be “human.”one hundred thousand years ago, at least six different species of humans inhabited earth. yet today there is only one—h from a renowned historian comes a groundbreaking narrative of humanity’s creation and evolution—a #1 international bestseller—that explores the ways in which biology and history have defined us and enhanced our understanding of what it means to be “human.”one hundred thousand years ago, at least six different species of humans inhabited earth. yet today there is only one—homo sapiens. what happened to the others? and what may happen to us?most books about the history of humanity pursue either a historical or a biological approach, but dr. yuval noah harari breaks the mold with this highly original.",54.23,5,In stock
6,Livro,The Requiem Red,young adult,"Patient twenty-nine.a monster roams the halls of soothing hills asylum. three girls dead. 29 is endowed with the curse…or gift of perception. she hears messages in music, sees lyrics in paintings. and the corn. a lifetime asylum resident, the orchestral corn music is the only constant in her life.mason, a new, kind orderly, sees 29 as a woman, not a lunatic. and as his bel patient twenty-nine.a monster roams the halls of soothing hills asylum. three girls dead. 29 is endowed with the curse…or gift.",22.65,1,In stock
7,Livro,The Dirty Little Secrets of Getting Your Dream Job,business,"Drawing on his extensive experience evaluating applicants for his marketing agency, and featuring stories based on real-life situations, sample cover letters, resumes, and straightforward advice, don raskin’s the dirty little secrets of getting your dream job offers all the necessary tools for navigating the tough job market and securing your dream job.don raskin owns and drawing on his extensive experience evaluating applicants for his marketing agency, and featuring stories based on real-life situations, sample cover letters, resumes, and straightforward advice, don raskin’s the dirty little secrets of getting your dream job offers all the necessary tools for navigating the tough job market and securing your dream job.don raskin owns and operates mme, an advertising and marketing agency in new york city. during his twenty-five years at the agency he has interviewed hundreds of new college graduates for positions within his agency and.",33.34,4,In stock
10,Livro,The Black Maria,poetry,"Praise for aracelis girmay:""[girmay's] every loss—she calls them estrangements—is a yearning for connection across time and place; her every fragment is a bulwark against ruin."" — o, the oprah magazine ""in aracelis girmay we have a poet who collects, polishes, and shares stories with such brilliant invention, tenderness, and intellectual liveliness that it is understandabl praise for aracelis girmay:""[girmay's] every loss—she calls them estrangements—is a yearning for connection across time and place; her every fragment is a bulwark against ruin."" — o, the oprah magazine ""in aracelis girmay we have a poet who collects, polishes, and shares stories with such brilliant invention, tenderness, and intellectual liveliness that it is understandable that we think of her as the blessed curator of our collective histories. there is in her art the vulnerability of one who lives inside of the stories that she gathers in this remarkable collection. her poems set off alarms even as they transform the world she inhabits, showing us, in the process, exactly what she asks of romare bearden’s art: ‘…how not to // assign all blackness near the sea / a captivity.’ this is one of the many sweet contradictions in the black maria, which ‘is a black flag / wounding the pastoral.’ i am deeply thankful that we have a poet of her unique and singular talent writing today."" —kwame dawestaking its name from the moon's dark plains, misidentified.",52.15,1,In stock
12,Livro,Shakespeare's Sonnets,poetry,"This book is an important and complete collection of the sonnets of william shakespeare. most readers are aware of the great plays and manuscripts written for the stage, but are unaware of the magnificent sonnets which were written around the same period. this is an excellent, complete collection of the sonnets and poetry of william shakespeare and should not be missed by this book is an important and complete collection of.",20.66,4,In stock
13,Livro,Set Me Free,young adult,"Aaron ledbetter’s future had been planned out for him since before he was born. each year, the ledbetter family vacation on tybee island gave aaron a chance to briefly free himself from his family’s expectations. when he meets jonas “lucky” luckett, a caricature artist in town with the traveling carnival, he must choose between the life that’s been mapped out for him, and aaron ledbetter’s future.",17.46,5,In stock
14,Livro,Scott Pilgrim's Precious Little Life (Scott Pilgrim #1),sequential art,"Scott pilgrim's life is totally sweet. he's 23 years old, he's in a rockband, he's ""between jobs"" and he's dating a cute high school girl. nothing could possibly go wrong, unless a seriously mind-blowing, dangerously fashionable, rollerblading delivery girl named ramona flowers starts cruising through his dreams and sailing by him at parties. will scott's awesome life get scott pilgrim's life is totally sweet. he's 23 years old, he's in a rockband, he's ""between.",52.29,5,In stock
15,Livro,Rip it Up and Start Again,music,"Punk's raw power rejuvenated rock, but by the summer of 1977 the movement had become a parody of itself. rip it up and start again is a celebration of what happened next.post-punk bands like pil, joy division, talking heads, the fall and the human league dedicated themselves to fulfilling punk's unfinished musical revolution. the post-punk groups were fervent modernists; w punk's raw power rejuvenated rock, but by the summer of 1977 the movement had.",35.02,5,In stock
16,Livro,"Our Band Could Be Your Life: Scenes from the American Indie Underground, 1981-1991",music,"This is the never-before-told story of the musical revolution that happened right under the nose of the reagan eighties--when a small but sprawling network of bands, labels, fanzines, radio stations, and other subversives reenergized american rock with punk rock's do-it-yourself credo and created music that was deeply personal, often brilliant, always challenging, and imme this is the never-before-told story of the musical revolution that happened right under the nose of the reagan eighties--when a small but sprawling network of bands, labels,.",57.25,3,In stock
17,Livro,Olio,poetry,"Part fact, part fiction, tyehimba jess's much anticipated second book weaves sonnet, song, and narrative to examine the lives of mostly unrecorded african american performers directly before and after the civil war up to world war i. olio is an effort to understand how they met, resisted, complicated, co-opted, and sometimes defeated attempts to minstrelize them.so, while part fact, part fiction, tyehimba jess's much anticipated second book weaves sonnet, song, and narrative to examine the lives of mostly unrecorded african american performers directly before and after the civil war up to world war i. olio is an effort to understand how they met, resisted, complicated, co-opted, and sometimes defeated attempts to minstrelize them.so, while i lead this choir, i still find thati'm being led…i'm.",23.88,1,In stock
18,Livro,Mesaerion: The Best Science Fiction Stories 1800-1849,science fiction,"Andrew barger, award-winning author and engineer, has extensively researched forgotten journals and magazines of the early 19th century to locate groundbreaking science fiction short stories in the english language. in doing so, he found what is possibly the first science fiction story by a female (and it is not from mary shelley). andrew located the first steampunk short andrew barger, award-winning author and engineer, has extensively researched forgotten journals and magazines of the early 19th century to locate groundbreaking science fiction short stories in the english language. in doing so, he found what is possibly the first science fiction story by a female (and it is not from mary shelley). andrew located the first steampunk short story, which has not been republished since 1844. there is the first voyage to the moon in a balloon, republished for the first time since.",37.59,1,In stock
19,Livro,Libertarianism for Beginners,politics,"Libertarianism isn't about winning elections; it is first and foremost a political philosophy--a description of how, in the opinion of libertarians, free people ought to treat one another, at least when they use the law, which they regard as potentially dangerous. if libertarians are correct, the law should intrude into people's lives as little as possible, rarely telling libertarianism isn't about winning elections; it is first and foremost a political philosophy--a description of how, in the opinion of libertarians, free people ought to treat one another, at least when they use the law, which they regard as.",51.33,2,In stock
20,Livro,It's Only the Himalayas,travel,"“wherever you go, whatever you do, just . . . don’t do anything stupid.” —my motherduring her yearlong adventure backpacking from south africa to singapore, s. bedford definitely did a few things her mother might classify as ""stupid."" she swam with great white sharks in south africa, ran from lions in zimbabwe, climbed a himalayan mountain without training in nepal, and wa “wherever you go, whatever you do, just . . . don’t do anything stupid.” —my motherduring her yearlong adventure backpacking from south africa to singapore, s. bedford definitely did a few things her mother might classify as ""stupid."" she swam with great white sharks in south africa, ran from lions in zimbabwe, climbed.",45.17,2,In stock
21,Livro,In Her Wake,thriller,"A perfect life … until she discovered it wasn’t her own.a tragic family event reveals devastating news that rips apart bella’s comfortable existence. embarking on a personal journey to uncover the truth, she faces a series of traumatic discoveries that take her to the ruggedly beautiful cornish coast, where hidden truths, past betrayals and a 25-year-old mystery threaten n a perfect life … until she discovered it wasn’t her own.a tragic family event reveals devastating news that rips apart.",12.84,1,In stock
22,Livro,How Music Works,music,"How music works is david byrne’s remarkable and buoyant celebration of a subject he has spent a lifetime thinking about. in it he explores how profoundly music is shaped by its time and place, and he explains how the advent of recording technology in the twentieth century forever changed our relationship to playing, performing, and listening to music.acting as historian an how music works is david byrne’s remarkable and buoyant celebration of a subject he has spent a lifetime thinking about. in it he explores how profoundly music is shaped by its time and place, and he explains how the advent of recording technology in the twentieth century forever changed our relationship to playing, performing, and listening to music.acting as historian.",37.32,2,In stock
23,Livro,"Foolproof Preserving: A Guide to Small Batch Jams, Jellies, Pickles, Condiments, and More: A Foolproof Guide to Making Small Batch Jams, Jellies, Pickles, Condiments, and More",food and drink,"Canning perfected the america’s test kitchen way. the art of preserving produce by canning and preserving has come full circle from grandmother's kitchen to a whole new generation now eager to learn it. this detailed guide to home preserving is perfect for novice canners and experts alike and offers more than 100 foolproof recipes across a wide range of categories, from sw canning perfected the america’s test kitchen way. the art of preserving produce by canning and preserving has come full circle from.",30.52,3,In stock
24,Livro,Chase Me (Paris Nights #2),romance,"A michelin two-star chef at twenty-eight, violette lenoir could handle anything, including a cocky burglar who broke into her restaurant in the middle of the night.or so she thought.elite counterterrorist operative chase “smith” had been through things that made hell week look easy. but nothing had prepared him for a leather-clad blonde who held him at bay at knifepoint an a michelin two-star chef at twenty-eight, violette lenoir could handle anything, including a cocky burglar who broke into her restaurant in the middle of the night.or so she thought.elite counterterrorist operative chase “smith” had been through.",25.27,5,In stock
25,Livro,Black Dust,romance,"No matter how busy he keeps himself, successful broadway musician tobias spence can’t outrun the memory of a tragic car crash from his past that claimed a friend’s life and permanently injured his former boyfriend, emmett.even after losing tobias, emmett henderson made peace with that awful night, living in his indiana hometown where he has become a revered choral director no matter how busy he keeps himself, successful broadway musician tobias spence can’t outrun the memory of a tragic car crash from his past that claimed a friend’s life and permanently injured his former boyfriend, emmett.even after losing tobias, emmett henderson made peace with that awful night, living.",34.53,5,In stock
26,Livro,Birdsong: A Story in Pictures,childrens,"Bring the thrilling story of one red bird to life. when an innocent bird meets two cruel kids, their world is forever changed. but exactly how that change unfolds is up to you, in the tradition of kamishibai—japanese paper theater. the wordless story by master cartoonist james sturm is like a haiku—the elegant images leave space for children to inhabit this timeless tale—a bring the thrilling story of one red bird to life. when an innocent bird meets two cruel kids, their world is forever changed. but exactly how that change unfolds is up to.",54.64,3,In stock
29,Livro,Worlds Elsewhere: Journeys Around Shakespeare’s Globe,nonfiction,"Anti-apartheid activist, bollywood screenwriter, nazi pin-up, hero of the wild west: this is shakespeare as you have never seen him before.from the sixteenth-century baltic to the american revolution, from colonial india to the skyscrapers of modern-day shanghai, shakespeare’s plays appear at the most fascinating of times and in the most unexpected of places. no other writ anti-apartheid activist, bollywood screenwriter, nazi pin-up, hero of the wild west: this is shakespeare as you have never seen him before.from the sixteenth-century baltic to the american revolution, from colonial india to the skyscrapers of modern-day shanghai, shakespeare’s plays appear at the most fascinating of times and in the most unexpected of places. no other writer’s work has been performed, translated, adapted and altered in such a remarkable variety of cultures and languages. but what is it about william shakespeare – a man from warwickshire who never once set foot outside england – that has made him at home in so many places around the globe?travelling across four continents, six countries and 400 years, andrew dickson takes us on a personal journey rich in insight and surprise. we.",40.3,5,In stock
30,Livro,Wall and Piece,art,"Banksy, britain's now-legendary ""guerilla"" street artist, has painted the walls, streets, and bridges of towns and cities throughout the world. not only did he smuggle his pieces into four of new york city's major art museums, he's also ""hung"" his work at london's tate gallery and adorned israel's west bank barrier with satirical images. banksy's identity remains unknown, banksy, britain's now-legendary ""guerilla"" street artist,.",44.18,4,In stock
31,Livro,The Four Agreements: A Practical Guide to Personal Freedom,spirituality,"In the four agreements, don miguel ruiz reveals the source of self-limiting beliefs that rob us of joy and create needless suffering. based on ancient toltec wisdom, the four agreements offer a powerful code of conduct that can rapidly transform our lives to a new experience of freedom, true happiness, and love. the four agreements are: be impeccable with your word, don't in the four agreements, don.",17.66,5,In stock
32,Livro,The Five Love Languages: How to Express Heartfelt Commitment to Your Mate,nonfiction,"Are you and your spouse speaking the same language? while love is a many splendored thing, it is sometimes a very confusing thing, too. and as people come in all varieties, shapes, and sizes, so do their choices of personal expressions of love. but more often than not, the giver and the receiver express love in two different ways. this can lead to misunderstanding, quarrel are you and your spouse speaking the same language? while love is a many splendored thing, it is sometimes a very confusing thing, too. and as people come in all varieties, shapes, and sizes, so.",31.05,3,In stock
33,Livro,The Elephant Tree,thriller,"Mark fallon is an overworked detective investigating a spate of attacks at a string of high profile city centre nightclubs. scott is a dejected 24 year old struggling to make ends meet working for his brother and supplementing his income with a small-scale drug dealing operation. angela is an attractive 23 year old, raised by her father, a career criminal and small time dr mark fallon is an overworked detective investigating a spate of attacks at a string of high profile city centre nightclubs. scott is a dejected.",23.82,5,In stock
34,Livro,The Bear and the Piano,childrens,"One day, a young bear stumbles upon something he has never seen before in the forest. as time passes, he teaches himself how to play the strange instrument, and eventually the beautiful sounds are heard by a father and son who are picnicking in the woods. the bear goes with them on an incredible journey to new york, where his piano playing makes him a huge star. he has fam one day, a young bear stumbles upon something he has never seen before in the forest.",36.89,1,In stock
35,Livro,Sophie's World,philosophy,"A page-turning novel that is also an exploration of the great philosophical concepts of western thought, sophie’s world has fired the imagination of readers all over the world, with more than twenty million copies in print.one day fourteen-year-old sophie amundsen comes home from school to find in her mailbox two notes, with one question on each: “who are you?” and “where a page-turning novel that is also an exploration of the great philosophical concepts of western thought, sophie’s world has fired the imagination of readers all over the world, with more than twenty million copies in print.one day fourteen-year-old sophie amundsen comes home from school to.",15.94,5,In stock
38,Livro,"In a Dark, Dark Wood",mystery,"In a dark, dark wood nora hasn't seen clare for ten years. not since nora walked out of school one day and never went back. there was a dark, dark houseuntil, out of the blue, an invitation to clare’s hen do arrives. is this a chance for nora to finally put her past behind her?and in the dark, dark house there was a dark, dark roombut something goes wrong. very wrong.and i in a dark, dark wood nora.",19.63,1,In stock
39,Livro,Behind Closed Doors,thriller,"The 2016 debut bloggers can't stop raving about. perfect for fans of the girl on the train and the ice twins everyone knows a couple like jack and grace.he has looks and wealth, she has charm and elegance. you might not want to like them, but you do. though, you’d like to get to know grace better.but it’s difficult, because you realise jack and grace are never apart.some the 2016 debut bloggers can't stop raving about. perfect for fans of the girl on the train and the ice twins everyone knows a couple like jack and.",52.22,4,In stock
40,Livro,You can't bury them all: Poems,poetry,"A poetry that is at once harrowing, angry, and achingly beautiful patrick woodcock has spent the past seven years engaging with and being shaped by the people, politics, and landscapes of the kurdish north of iraq, fort good hope in the northwest territories, and azerbaijan. his powerful new collection offers a poetry that simultaneously explores hope and horror while doc a poetry that is at once harrowing, angry, and achingly beautiful patrick woodcock has spent the past seven years engaging with and being shaped by the people, politics, and landscapes of the kurdish north of iraq, fort good hope in the northwest territories, and azerbaijan. his powerful new collection offers a poetry that simultaneously explores hope and horror while documenting the transformative processes of coping. you can’t bury them all follows the narratives we construct to survive the tragic failures of our humanity to their very end: everything.",33.63,2,In stock
41,Livro,Slow States of Collapse: Poems,poetry,"The eagerly anticipated debut from one of canada’s most exciting new poets in her debut collection, ashley-elizabeth best explores the cultivation of resilience during uncertain and often trying times. it’s a book built around day-to-day conflicts — poems about love, family, grief, power, and longing. navigating the fault lines of popular culture and traditional poetry to the eagerly anticipated debut from one of canada’s most exciting new poets in her debut collection, ashley-elizabeth best explores the cultivation of resilience during uncertain and often trying times. it’s a book built around day-to-day conflicts — poems about love, family, grief, power, and longing. navigating the fault lines of.",57.31,3,In stock
42,Livro,Reasons to Stay Alive,nonfiction,"I want life. i want to read it and write it and feel it and live it. i want, for as much of the time as possible in this blink-of-an-eye existence we have, to feel all that can be felt. i hate depression. i am scared of it. terrified, in fact. but at the same time, it has made me who i am. and if - for me - it is the price of feeling life, it's a price always worth paying. i want life. i want to read it and write it and feel it and live it. i want, for as much of the time as possible in this blink-of-an-eye existence we have, to feel all that can be felt. i hate depression. i am.",26.41,2,In stock
43,Livro,Private Paris (Private #10),fiction,"Paris is burning--and only private's jack morgan can put out the fire.when jack morgan stops by private's paris office, he envisions a quick hello during an otherwise relaxing trip filled with fine food and sightseeing. but jack is quickly pressed into duty after a call from his client sherman wilkerson, asking jack to track down his young granddaughter who is on the run f paris is burning--and only private's jack morgan can put out the fire.when jack morgan stops by private's paris office, he envisions a quick hello during an otherwise relaxing trip filled.",47.61,5,In stock
