ID_Produto,Produto,Titulo,Categoria,Descricao,Preco,Avaliacao,Disponibilidade
722,Livro,"The Sandman, Vol. 3: Dream Country (The Sandman (volumes) #3)",sequential art,"The third volume of the sandman collection is a series of four short comic book stories. in each of these otherwise unrelated stories, morpheus serves only as a minor character. here we meet the mother of morpheus's son, find out what cats dream about, and discover the true origin behind shakespeare's a midsummer's night dream. the latter won a world fantasy award for best the third volume of the sandman collection is.",55.55,5,In stock
723,Livro,The Rose & the Dagger (The Wrath and the Dawn #2),fantasy,"The much anticipated sequel to the breathtaking the wrath and the dawn, lauded by publishers weekly as ""a potent page-turner of intrigue and romance.""i am surrounded on all sides by a desert. a guest, in a prison of sand and sun. my family is here. and i do not know whom i can trust.in a land on the brink of war, shahrzad has been torn from the love of her husband khalid, the much anticipated sequel to the breathtaking the wrath and the dawn, lauded by publishers weekly as ""a potent page-turner of intrigue and romance.""i am surrounded on all sides by a desert. a guest, in a prison of sand and sun. my family is here. and i do not know whom i can trust.in a land on the brink of war, shahrzad has been torn from the love of her.",58.64,4,In stock
724,Livro,The Road to Little Dribbling: Adventures of an American in Britain (Notes From a Small Island #2),travel,"The hilarious and loving sequel to a hilarious and loving classic of travel writing: notes from a small island, bill bryson’s valentine to his adopted country of englandin 1995 bill bryson got into his car and took a weeks-long farewell motoring trip about england before moving his family back to the united states. the book about that trip, notes from a small island, is up the hilarious and loving sequel to a hilarious and loving classic of travel writing: notes from a small island, bill bryson’s valentine to his adopted country of englandin 1995 bill.",23.21,1,In stock
725,Livro,The Rise of Theodore Roosevelt (Theodore Roosevelt #1),biography,"Selected by the modern library as one of the 100 best nonfiction books of all timedescribed by the chicago tribune as ""a classic,"" the rise of theodore roosevelt stands.",42.57,3,In stock
726,Livro,The Restaurant at the End of the Universe (Hitchhiker's Guide to the Galaxy #2),science fiction,"Facing annihilation at the hands of the warlike vogons is a curious time to have a craving for tea. it could only happen to the cosmically displaced arthur dent and his curious comrades in arms as they hurtle across space powered by pure improbabilityband desperately in search of a place to eat.among arthur's motley shipmates are ford prefect, a longtime friend and expert facing annihilation at the hands of the warlike vogons is a curious time to have a craving for tea. it could only happen to the cosmically displaced arthur dent and his curious comrades in arms as they hurtle across space powered by pure improbabilityband desperately in search of a place to eat.among arthur's motley shipmates.",10.92,1,In stock
728,Livro,The Red Tent,historical fiction,"Her name is dinah. in the bible, her life is only hinted at in a brief and violent detour within the more familiar chapters of the book of genesis that are about her father, jacob, and his dozen sons. told in dinah's voice, this novel reveals the traditions and turmoils of ancient womanhood--the world of the red tent. it begins with the story of her mothers--leah, rachel, her name is dinah. in the bible, her life is only hinted at in a brief and violent detour within the more familiar chapters of the book of genesis that are about her father, jacob, and his.",35.66,5,In stock
730,Livro,The Purest Hook (Second Circle Tattoos #3),romance,"Can a love built on secrets survive?rugged, hot, and rock hard, dred zander is exactly the type of man that normally sends pixie running. not dreaming about running her hands down his washboard abs...and lower. the lead singer and guitarist for the band preload embodies trouble behind his quick smile and guarded eyes, and pixie left trouble behind her years ago along with can a love built on secrets survive?rugged, hot, and rock hard, dred zander is exactly the type of man that normally sends pixie running. not dreaming about running her hands down his washboard abs...and lower. the lead singer and guitarist for the band preload embodies trouble behind his quick smile and guarded eyes, and pixie left trouble behind her years ago along with the name.",12.25,1,In stock
731,Livro,The Picture of Dorian Gray,classics,"Introduction by jeffrey eugenides written in his distinctively dazzling manner, oscar wilde’s story of a fashionable young man who sells his soul for eternal youth and beauty is the author’s most popular work. the tale of dorian gray’s moral disintegration caused a scandal when it ﬁrst appeared in 1890, but though wilde was attacked for the novel’s corrupting inﬂuence, he ﻿introduction by jeffrey eugenides ﻿written in his distinctively dazzling manner, oscar wilde’s story of a fashionable young man who sells his soul for eternal youth and beauty is the author’s most popular work. the tale of dorian gray’s.",29.7,2,In stock
733,Livro,The Obsession,romance,"The riveting new novel from the #1 new york times bestselling author of the liar.naomi bowes lost her innocence the night she followed her father into the woods. in freeing the girl trapped in the root cellar, naomi revealed the horrible extent of her father’s crimes and made him infamous.now a successful photographer living under the name naomi carson, she has found a pla the riveting new novel from the #1 new york times bestselling author of the liar.naomi bowes lost her innocence the night she followed her father into the woods. in freeing the girl trapped in the root.",45.43,1,In stock
734,Livro,The Nightingale,fiction,"In love we find out who we want to be.in war we find out who we are.france, 1939in the quiet village of carriveau, vianne mauriac says goodbye to her husband, antoine, as he heads for the front. she doesn’t believe that the nazis will invade france...but invade they do, in droves of marching soldiers, in caravans of trucks and tanks, in planes that fill the skies and drop in love we find out who we want to be.in war we find out who we are.france, 1939in the quiet village of carriveau, vianne mauriac says goodbye to her husband, antoine, as he heads for the front. she doesn’t believe that the nazis will invade france...but invade they do, in droves of marching soldiers, in caravans of trucks and tanks, in planes that fill the skies and drop bombs upon the innocent. when france is overrun, vianne is forced to take an enemy into her house, and suddenly her every move is watched; her life and her child’s life is at constant risk. without food or money or hope, as danger escalates around her, she.",26.26,4,In stock
735,Livro,The New Guy (and Other Senior Year Distractions),young adult,"A ridiculously cute, formerly-famous new guy dropping into your life? it's practically every girl's dream. but not jules mccallister-morgan's. i realize that on paper i look like your standard type-a, neurotic, overachiever. and maybe i am. but i didn't get to be the editor of my school's long-revered newspaper by just showing up*. i have one main goal for my senior year-e a ridiculously cute, formerly-famous new guy dropping into your life? it's practically every girl's dream. but not jules mccallister-morgan's. i realize that on paper i look like your standard type-a, neurotic, overachiever. and maybe i am. but i didn't get to be the editor of my school's long-revered newspaper by just showing up*. i have one main goal for my senior year-early acceptance into my first choice ivy league college-and i will not be deterred.",44.92,3,In stock
736,Livro,The Nanny Diaries (Nanny #1),womens fiction,"Wanted: one young woman to take care of four-year-old boy. must be cheerful, enthusiastic and selfless--bordering on masochistic. must relish sixteen-hour shifts with a deliberately nap-deprived preschooler. must love getting thrown up on, literally and figuratively, by everyone in his family. must enjoy the delicious anticipation of ridiculously erratic pay. mostly, must wanted: one young woman to take care of four-year-old boy. must be cheerful, enthusiastic and selfless--bordering on masochistic. must relish sixteen-hour shifts with a deliberately nap-deprived preschooler. must love getting thrown up on, literally and figuratively, by everyone in his family. must enjoy the delicious anticipation of ridiculously erratic pay. mostly, must love being treated like fungus found growing out of employers hermès bag. those who take it personally need not apply.who wouldn't want this job? struggling to graduate from nyu and afford her.",52.53,5,In stock
737,Livro,The Name of God is Mercy,nonfiction,"New york times bestseller •in his first book published as pope, and in conjunction with the extraordinary jubilee of mercy, pope francis here invites all humanity to an intimate and personal dialogue on the subject closest to his heart—mercy—which has long been the cornerstone of his faith and is now the central teaching of his papacy. in this conversation with vatican r new york times bestseller • in his first book published as pope, and in conjunction with the extraordinary jubilee of mercy, pope francis here invites all humanity to an intimate and personal dialogue on the subject closest to his heart—mercy—which has long been the cornerstone of his faith and is now the central teaching of his papacy. in this conversation with vatican reporter andrea tornielli, francis explains—through memories from his youth and moving anecdotes from his experiences as a pastor—why “mercy is the first attribute of god.” god “does not want anyone to be lost. his mercy is infinitely greater than our sins,” he writes. as well, the church cannot close the door on anyone, francis asserts—on the contrary, its duty is to go out into the world to find its way into the consciousness of people so that they can assume responsibility for, and move away from, the bad things they have done. the first jesuit and the first south american to be elected bishop of rome, pope francis has traveled around the world spreading god’s message of mercy to the largest crowds in papal history. clear and profound, the name of god is mercy resonates with this desire to reach all those who are looking for meaning in life, a road to peace and reconciliation, and the healing of physical and spiritual wounds. it is being published in more than eighty countries around the world.“the name of god is mercy. there are no situations we cannot get out of,.",37.25,2,In stock
740,Livro,The Lonely Ones,childrens,"When your only friend is your own endless imagination, how do you escape your mind and connect to the world around you?with parents too busy to pay her attention, an older brother and sister who would rather spend their time with friends, and peers who oscillate between picking on her and simply ignoring her, it's no wonder that fain spends most of her time in a world of h when your only friend is your own endless imagination, how do you escape your mind and connect to the world around you? with parents too busy to pay her attention, an older brother and sister who would rather spend their time with friends, and peers who oscillate between picking on her and simply ignoring her, it's no wonder that fain spends most of her time in a world of her own making. during the day, fain takes solace in crafting.",43.59,5,In stock
741,Livro,The Lean Startup: How Today's Entrepreneurs Use Continuous Innovation to Create Radically Successful Businesses,business,"Most startups fail. but many of those failures are preventable. the lean startup is a new approach being adopted across the globe, changing the way companies are built and new products are launched. eric ries defines a startup asan organization dedicated to creating something new under conditions of extreme uncertainty. this is just as true for one person in a garage or a most startups fail. but many of those failures are preventable. the lean startup is a new approach being adopted across the globe, changing the way companies are built and new products are launched. eric ries defines a startup as an organization dedicated to creating something new under conditions of extreme uncertainty. this is just as true for one person in a garage or a group of seasoned professionals in a fortune 500 boardroom. what they have in common is a mission to penetrate that.",33.92,3,In stock
742,Livro,The Last Painting of Sara de Vos,historical fiction,"This is what we long for: the profound pleasure of being swept into vivid new worlds, worlds peopled by characters so intriguing and real that we can't shake them, even long after the reading's done. in his earlier, award-winning novels, dominic smith demonstrated a gift for coaxing the past to life. now, in the last painting of sara de vos, he deftly bridges the historica this is what we long for: the profound pleasure of being swept into vivid new worlds, worlds peopled by characters so intriguing and real that we can't shake them, even long after the reading's done. in his earlier, award-winning novels, dominic smith demonstrated a gift for coaxing the past to life. now, in the last painting of sara de vos, he deftly bridges the historical and the contemporary, tracking a collision course between a rare landscape by a female dutch painter of the golden age, an inheritor of the work in 1950s manhattan,.",55.55,2,In stock
743,Livro,"The Land of 10,000 Madonnas",young adult,Five teens backpack through europe to fulfill the mysterious dying wish of their friend.jesse lives with his history professor dad in a house covered with postcards of images of the madonna from all over the world. they’re gotten used to this life: two motherless dudes living among thousands of madonnas. but jesse has a heart condition that will ultimately cut his life tra five teens backpack through europe to fulfill the mysterious dying wish of their friend.jesse lives with his history professor dad in a house covered with postcards.,29.64,4,In stock
744,Livro,The Infinities,fiction,"On a languid midsummer’s day in the countryside, old adam godley, a renowned theoretical mathematician, is dying. his family gathers at his bedside: his son, young adam, struggling to maintain his marriage to a radiantly beautiful actress; his nineteen-year-old daughter, petra, filled with voices and visions as she waits for the inevitable; their mother, ursula, whose rela on a languid midsummer’s day in the countryside, old adam godley, a renowned theoretical mathematician, is dying. his family gathers at his bedside: his son, young adam, struggling to maintain his marriage to a radiantly beautiful actress; his nineteen-year-old daughter, petra, filled with voices and visions as she waits for the inevitable; their mother, ursula, whose relations with the godley children are strained at best; and petra’s “young man”—very likely more interested in the father than the daughter—who has arrived for a superbly.",27.41,1,In stock
745,Livro,The Husband's Secret,fiction,"At the heart of the husband’s secret is a letter that’s not meant to be readmy darling cecilia, if you’re reading this, then i’ve died...imagine that your husband wrote you a letter, to be opened after his death. imagine, too, that the letter contains his deepest, darkest secret—something with the potential to destroy not just the life you built together, but the lives of at the heart of the husband’s secret is a letter that’s not meant to be readmy darling cecilia, if you’re reading this, then i’ve died...imagine that your husband wrote you a letter, to be opened after his death. imagine, too, that the letter contains his deepest, darkest secret—something with the potential to destroy not just.",52.51,5,In stock
747,Livro,The Guns of August,history,"The pulitzer prize-winning classic about the outbreak of world war ihistorian & pulitzer prize-winning author barbara tuchman has brought to life again the people and events that led up to wwi. with attention to fascinating detail, and an intense knowledge of her subject and its characters, she reveals just how the war started, why, and why it could have been stopped b the pulitzer prize-winning classic about the outbreak of world war ihistorian & pulitzer.",14.54,2,In stock
748,Livro,The Guernsey Literary and Potato Peel Pie Society,historical fiction,"“ i wonder how the book got to guernsey? perhaps there is some sort of secret homing instinct in books that brings them to their perfect readers.” january 1946: london is emerging from the shadow of the second world war, and writer juliet ashton is looking for her next book subject. who could imagine that she would find it in a letter from a man she’s never met, a native o “ i wonder how the book got to guernsey? perhaps there is some sort of secret homing instinct in books that brings them to their perfect readers.” january 1946: london is emerging from the shadow of the second world war, and writer juliet ashton is looking for her next book subject. who could imagine that she would find it in a letter from a man she’s never met, a native of the island of guernsey, who has come across her.",49.53,1,In stock
751,Livro,The Girl with All the Gifts,horror,"Melanie is a very special girl. dr. caldwell calls her ""our little genius.""every morning, melanie waits in her cell to be collected for class. when they come for her, sergeant parks keeps his gun pointing at her while two of his people strap her into the wheelchair. she thinks they don't like her. she jokes that she won't bite, but they don't laugh.melanie loves school. sh melanie is a very special girl. dr. caldwell calls her ""our little genius.""every morning, melanie waits in her cell to.",49.47,3,In stock
754,Livro,The Exiled,mystery,"Can anyone ever truly outrun his past?back in the 1980s, wes raney was an ambitious new york city narcotics detective with a growing drug habit of his own. while working undercover on a high-risk case, he made decisions that ultimately cost him not only his career, but also his family. disgraced, raney fled-but history is finally catching up with him.now in his early forti can anyone ever truly outrun his past?back in the 1980s, wes raney was an ambitious new york city narcotics detective with a growing drug habit of his own. while working undercover on a high-risk case, he made decisions that ultimately cost him not only his career, but also his family.",43.45,3,In stock
756,Livro,"The Elegant Universe: Superstrings, Hidden Dimensions, and the Quest for the Ultimate Theory",science,"The international bestseller that inspired a major nova special and sparked a new understanding of the universe, now with a new preface and epilogue.brian greene, one of the world's leading string theorists, peels away layers of mystery to reveal a universe that consists of eleven dimensions, where the fabric of space tears and repairs itself, and all matter—from the small the international bestseller that inspired a major nova special and sparked a new understanding of the universe, now with a new preface.",13.03,4,In stock
757,Livro,"The Disappearing Spoon: And Other True Tales of Madness, Love, and the History of the World from the Periodic Table of the Elements",science,"From new york times bestselling author sam kean comes incredible stories of science, history, finance, mythology, the arts, medicine, and more, as told by the periodic table. why did gandhi hate iodine (i, 53)? how did radium (ra, 88) nearly ruin marie curie's reputation? and why is gallium (ga, 31) the go-to element for laboratory pranksters?*the periodic table is a crow from new york times bestselling author sam kean comes incredible stories of science, history, finance, mythology, the arts, medicine, and more, as told by the periodic table. why did gandhi hate iodine (i, 53)? how did radium (ra, 88) nearly ruin marie curie's reputation? and why is gallium (ga, 31) the go-to.",57.35,5,In stock
758,Livro,The Devil Wears Prada (The Devil Wears Prada #1),womens fiction,"A delightfully dishy novel about the all-time most impossible boss in the history of impossible bosses. andrea sachs, a small-town girl fresh out of college, lands the job “a million girls would die for.” hired as the assistant to miranda priestly, the high-profile, fabulously successful editor of ""runway ""magazine, andrea finds herself in an office that shouts ""prada! arm a delightfully dishy novel about the all-time most impossible boss in the history of impossible bosses. andrea sachs, a small-town girl fresh out of college, lands the job “a million girls would die for.” hired as the assistant to miranda priestly, the high-profile, fabulously successful editor of ""runway ""magazine, andrea finds herself in an office that shouts ""prada! armani! versace!"" at every turn, a world populated by impossibly thin, heart-wrenchingly stylish women and beautiful men clad in fine-ribbed turtlenecks and tight leather pants that show off their lifelong dedication to the gym. with breathtaking ease, miranda can turn each and every one of these hip sophisticates into a scared, whimpering child. the devil wears prada gives a rich and hilarious new meaning to.",44.29,1,In stock
760,Livro,The Day the Crayons Came Home (Crayons),childrens,"The companion to the #1 blockbuster bestseller, the day the crayons quit! i'm not sure what it is about this kid duncan, but his crayons sure are a colorful bunch of characters! having soothed the hurt feelings of one group who threatened to quit, duncan now faces a whole new group of crayons asking to be rescued. from maroon crayon, who was lost beneath the sofa cushions the companion to the #1 blockbuster bestseller, the day the crayons quit! i'm not sure what it is about this kid duncan, but his crayons sure are a colorful bunch of characters! having soothed the hurt feelings of one group who threatened to quit, duncan now faces a whole new group of crayons asking to be rescued. from maroon crayon, who was lost beneath the sofa cushions and then broken in two after dad sat on him; to poor turquoise, whose head is now stuck to one of duncan's stinky socks after they both ended up in the dryer together; to pea green, who knows darn well that no kid likes peas and who ran away—each and every crayon has a woeful.",26.33,5,In stock
761,Livro,The Da Vinci Code (Robert Langdon #2),fiction,"An ingenious code hidden in the works of leonardo da vinci. a desperate race through the cathedrals and castles of europe. an astonishing truth concealed for centuries . . . unveiled at last.while in paris, harvard symbologist robert langdon is awakened by a phone call in the dead of the night. the elderly curator of the louvre has been murdered inside the museum, his body an ingenious code hidden in the works of leonardo da vinci. a desperate race through the cathedrals and castles of europe. an astonishing truth concealed for centuries . . . unveiled at last.while in paris, harvard symbologist robert langdon is awakened by a phone call in the dead of the night.",22.96,2,In stock
762,Livro,The Cuckoo's Calling (Cormoran Strike #1),mystery,"A brilliant debut mystery in a classic vein: detective cormoran strike investigates a supermodel's suicide. after losing his leg to a land mine in afghanistan, cormoran strike is barely scraping by as a private investigator. strike is down to one client, and creditors are calling. he has also just broken up with his longtime girlfriend and is living in his office.then john a brilliant debut mystery in a classic vein: detective cormoran strike investigates a supermodel's suicide. after losing his leg to a land mine in afghanistan, cormoran strike is barely scraping by as a private investigator. strike is down to one client, and creditors are calling. he has also just broken up with his longtime girlfriend and is living in his office.then john bristow walks.",19.21,1,In stock
763,Livro,The Complete Stories and Poems (The Works of Edgar Allan Poe [Cameo Edition]),classics,"This single volume brings together all of poe's stories and poems, and illuminates the diverse.",26.78,4,In stock
766,Livro,The Cat in the Hat (Beginner Books B-1),childrens,"Join the cat in the hat as he makes learning to read a joy! it’s a rainy day and dick and sally can’t find anything to do . . . until the cat in the hat unexpectedly appears and turns their dreary afternoon into a fun-filled extravaganza! this beloved beginner book by dr. seuss, which also features timeless dr. seuss characters such as fish and thing 1 and thing 2, is fun join the cat in the hat as he makes learning to read a joy! it’s a rainy day and dick and sally can’t find anything to do . . . until the.",16.26,2,In stock
