ID_Produto,Produto,Titulo,Categoria,Descricao,Preco,Avaliacao,Disponibilidade
242,Livro,The Marriage of Opposites,historical fiction,"From the new york times bestselling author of the dovekeepers and the museum of extraordinary things: a forbidden love story set on the tropical island of st. thomas about the extraordinary woman who gave birth to painter camille pissarro; the father of impressionism.growing up on idyllic st. thomas in the early 1800s, rachel dreams of life in faraway paris. rachel's mothe from the new york times bestselling author of the dovekeepers and the museum of extraordinary things: a forbidden love story set on the tropical island of st. thomas about the extraordinary woman who gave birth to painter camille pissarro; the father of impressionism.growing up on idyllic st. thomas in the early 1800s, rachel dreams of life in faraway paris. rachel's mother, a pillar of their small refugee community of jews who escaped the inquisition, has never forgiven her daughter for being a difficult girl who refuses to live by the rules. growing up,.",28.08,4,In stock
243,Livro,The Lucifer Effect: Understanding How Good People Turn Evil,psychology,"Renowned social psychologist and creator of the ""stanford prison experiment,"" philip zimbardo explores the mechanisms that make good people do bad things, how moral people can be seduced into acting immorally, and what this says about the line separating good from evil.the lucifer effect explains how—and the myriad reasons why—we are all susceptible to the lure of “the dar renowned social psychologist and creator of the ""stanford prison experiment,"" philip zimbardo explores the mechanisms that make good people do bad things, how moral people can be seduced into acting immorally, and what this says about the line separating good from evil.the lucifer effect explains how—and the myriad reasons why—we are all susceptible to the lure of “the dark side.” drawing on examples from history as well as his own trailblazing research, zimbardo details how situational forces and group dynamics can work in concert to make monsters.",10.4,1,In stock
244,Livro,The Long Haul (Diary of a Wimpy Kid #9),humor,Greg heffley and his family hit the road in author-illustrator jeff kinney's.,44.07,1,In stock
245,Livro,The Loney,horror,"If it had another name, i never knew, but the locals called it the loney - that strange nowhere between the wyre and the lune where hanny and i went every easter time with mummer, farther, mr and mrs belderboss and father wilfred, the parish priest.it was impossible to truly know the place. it changed with each influx and retreat, and the neap tides would reveal the skelet if it had another name, i never knew, but the locals called it the loney - that strange nowhere between the wyre and the lune where hanny.",23.4,1,In stock
246,Livro,The Literature Book (Big Ideas Simply Explained),nonfiction,"A global look at the greatest works of eastern and western literature and the themes that unite them, for students and lovers of literature and reading.the literature book is a fascinating journey through the greatest works of world literature, from the iliad to don quixote to the great gatsby. around 100 crystal-clear articles explore landmark novels, short stories, plays a global look at the greatest works of eastern and western literature and the themes that unite them, for students and lovers of literature and reading.the literature book is a fascinating journey through the greatest works of world literature, from the iliad to don quixote to the great gatsby. around 100 crystal-clear articles explore landmark novels, short stories, plays, and poetry that reinvented the art of writing in their time,.",17.43,3,In stock
247,Livro,The Last Mile (Amos Decker #2),mystery,"In his #1 new york times bestseller memory man, david baldacci introduced the extraordinary detective amos decker-the man who can forget nothing. now, decker returns in a spectacular new thriller . . . the last mileconvicted murderer melvin mars is counting down the last hours before his execution--for the violent killing of his parents twenty years earlier--when he's gran in his #1 new york times bestseller memory man, david baldacci introduced the extraordinary detective amos decker-the man who can forget nothing. now, decker returns in a spectacular new thriller . . . the last mileconvicted murderer melvin mars is counting down the last hours before his execution--for the violent killing of his parents twenty years earlier--when he's granted an unexpected reprieve. another man has confessed to the crime.amos decker, newly hired.",54.21,2,In stock
249,Livro,The Hidden Oracle (The Trials of Apollo #1),fantasy,"How do you punish an immortal?by making him human.after angering his father zeus, the god apollo is cast down from olympus. weak and disorientated, he lands in new york city as a regular teenage boy. now, without his godly powers, the four-thousand-year-old deity must learn to survive in the modern world until he can somehow find a way to regain zeus's favour.but apollo ha how do you punish an immortal?by making him human.after angering his father zeus, the god apollo is cast down from olympus.",52.26,2,In stock
250,Livro,The Help Yourself Cookbook for Kids: 60 Easy Plant-Based Recipes Kids Can Make to Stay Healthy and Save the Earth,food and drink,"Struggling to get your kids to eat their fruits and vegetables? try letting them help themselves!experts tell us the best way to teach kids healthy eating habits is to involve them in the process. this irresistibe cookbook presents 60 appealing recipes kids will beg to make themselves, in fun and charming illustrations they will love. bursting with color, humor, cute anima struggling to get your kids to eat their fruits and vegetables? try letting them help themselves!experts tell us the best way to teach kids healthy eating habits is to involve them in the process. this irresistibe cookbook presents 60 appealing recipes kids will beg to make themselves, in fun and charming illustrations they will love. bursting with color, humor, cute animal characters, and cool facts (did you know your brain actually shrinks when you’re dehydrated? drink water, quick!), help yourself empowers children to take charge of their own nutrition.",28.77,3,In stock
251,Livro,The Guilty (Will Robie #4),thriller,"Will robie is the government's most professional, disciplined, and lethal assassin. he infiltrates the most hostile countries in the world, defeats our enemies' advanced security measures, and eliminates threats before they ever reach our shores. but now, his skills have left him. sent overseas on a critical assignment, he fails, unable to pull the trigger. absent his tale will robie is the government's most professional, disciplined, and lethal assassin. he infiltrates the most hostile countries in the world, defeats our enemies' advanced security measures, and eliminates threats before they ever reach our shores. but now, his skills have left him. sent overseas on a critical assignment, he fails, unable to pull the trigger. absent his talents, robie is a man without a mission, and without a purpose.to recover what he has lost, robie must confront what he has tried to forget for over twenty years: his own past. the guilty will robie escaped his small gulf coast hometown of cantrell, mississippi after high school, severing all personal ties, and never looked back. not once. not until the unimaginable occurs. his father, dan robie, has been arrested and charged with murder.father and son haven't spoken or.",13.82,2,In stock
252,Livro,The First Hostage (J.B. Collins #2),fiction,"“the president of the united states . . . is missing.”with these words, new york times journalist j. b. collins, reporting from the scene of a devastating attack by isis terrorists in amman, jordan, puts the entire world on high alert. the leaders of israel and palestine are critically injured, jordan’s king is fighting for his life, and the u.s. president is missing and p “the president of the united states . . . is missing.”with these words, new york times journalist j. b. collins, reporting from the scene of a devastating attack by isis terrorists in amman, jordan, puts the entire world on high alert.",25.85,3,In stock
254,Livro,The Darkest Lie,young adult,"“the mother i knew would never do those things.but maybe i never knew her after all.”clothes, jokes, coded messages…cecilia brooks and her mom shared everything. at least, cece thought they did. six months ago, her mom killed herself after accusations of having sex with a student, and cece’s been the subject of whispers and taunts ever since. now, at the start of her high “the mother i knew would never do those things.but maybe i never knew her after all.”clothes, jokes, coded messages…cecilia brooks and her mom shared everything. at least, cece thought they did. six months ago, her mom killed herself after accusations of having sex with a student, and cece’s been the subject.",35.35,5,In stock
255,Livro,The Bane Chronicles (The Bane Chronicles #1-11),fantasy,"Fans of the mortal instruments and the infernal devices can get to know warlock magnus bane like never before in this collection of new york times bestselling tales, in print for the first time with an exclusive new story and illustrated material.this collection of eleven short stories illuminates the life of the enigmatic magnus bane, whose alluring personality, flamboyan fans of the mortal instruments and the infernal devices can get to know warlock magnus bane like never before in this collection of new york times bestselling tales, in print for.",44.73,4,In stock
256,Livro,The Bad-Ass Librarians of Timbuktu: And Their Race to Save the World’s Most Precious Manuscripts,nonfiction,"To save precious centuries-old arabic texts from al qaeda, a band of librarians in timbuktu pulls off a brazen heist worthy of ocean’s eleven.in the 1980s, a young adventurer and collector for a government library, abdel kader haidara, journeyed across the sahara desert and along the niger river, tracking down and salvaging tens of thousands of ancient islamic and secular to save precious centuries-old arabic texts from al qaeda, a band of librarians in timbuktu pulls off a brazen heist worthy of ocean’s eleven.in the 1980s, a young adventurer and collector for a government library, abdel kader haidara, journeyed across the sahara desert and along the niger river, tracking down and salvaging tens of thousands of ancient islamic and secular manuscripts that had fallen into obscurity. the bad-ass librarians of timbuktu tells the incredible story of how haidara, a mild-mannered archivist and historian from the legendary city of timbuktu, later became.",15.77,1,In stock
257,Livro,The 14th Colony (Cotton Malone #11),thriller,"Shot down over siberia in what was to be a simple meet-and-greet-mission, ex-justice department agent cotton malone is forced into a fight for survival against aleksandr zorin, whose loyalty to the former soviet union has festered for decades into an intense hatred of the united states.before escaping, malone learns that zorin and another ex-kgb officer, this one a sleeper shot down over siberia in what was to be a simple meet-and-greet-mission, ex-justice department agent cotton malone is forced into a fight for survival against aleksandr zorin, whose loyalty to the former soviet union has festered for decades into an intense hatred of the united states.before escaping, malone learns that zorin and another ex-kgb officer, this one a sleeper still imbedded in the west, are headed overseas to washington d.c. inauguration day-noon on january 20th-is only hours away. a flaw in the constitution, and an even more flawed.",39.24,1,In stock
258,Livro,That Darkness (Gardiner and Renner #1),mystery,"As a forensic investigator for the cleveland police department, maggie gardiner has seen her share of jane does. the latest is an unidentified female in her early teens, discovered in a local cemetery. more shocking than the girl’s injuries—for maggie at least—is the fact that no one has reported her missing. she and the detectives assigned to the case (including her cop e as a forensic investigator for the cleveland police department, maggie gardiner has seen her share of jane does. the latest is an unidentified female in her early teens, discovered in a local cemetery. more shocking than the girl’s injuries—for maggie at least—is the fact that no one has reported her missing. she and the detectives assigned to the case (including her cop ex-husband) are determined to.",13.92,1,In stock
259,Livro,Tastes Like Fear (DI Marnie Rome #3),mystery,"Sarah hilary won the 2015 theakston's crime novel of the year with her debut, the 2014 richard and judy pick someone else's skin. she followed up with no other darkness, proclaimed as 'riveting' by lisa gardner and 'truly mesmerising' by david mark. now d.i. marnie rome returns in her third novel.home is where harm lies...the young girl who causes the fatal car crash disap sarah hilary won the 2015 theakston's crime novel of the year with her debut, the 2014 richard and judy pick someone else's skin. she followed up with no other darkness, proclaimed as.",10.69,1,In stock
260,Livro,Take Me with You,fiction,"August shroeder, a burned-out teacher, has been sober since his 19-year-old son died. every year he's spent the summer on the road, but making it to yellowstone this year means everything. the plan had been to travel there with his son, but now august is making the trip with philip's ashes instead. an unexpected twist of fate lands august with two extra passengers for his august shroeder, a burned-out teacher, has been sober since his 19-year-old son died. every year he's spent the summer.",45.21,3,In stock
261,Livro,Swell: A Year of Waves,nonfiction,"Wave watchers around the world know that no two waves are the same. yet each and every wave that rises, peaks, and crashes onto the beach is generated by a much larger force originating thousands of miles away. surf journalist team evan slater and peter taras capture the essence of waves and the swells that produce them in this breathtaking collection of wave photography. wave watchers around the world know that no two waves are the same. yet each and every wave that rises, peaks, and crashes onto the beach.",45.58,1,In stock
262,Livro,Superman Vol. 1: Before Truth (Superman by Gene Luen Yang #1),sequential art,"Superman is going through some changes. first, there's his new ""solar flare"" power, which releases tremendous amounts of energy but leaves him functionally human - fragile, vulnerable, prone to hangovers - for 24 hours.but an even bigger change is coming. a new company called hordr has sprung up, and its business is secrets. if you have one that you want to keep hidden, hr superman is going through some changes. first, there's his new ""solar flare"" power, which releases tremendous amounts of energy but leaves him functionally human - fragile, vulnerable, prone to hangovers - for 24 hours.but an even bigger change is coming. a new company called hordr has sprung up, and its business is secrets. if you have one that you want.",11.89,5,In stock
263,Livro,Still Life with Bread Crumbs,fiction,"A superb love story from anna quindlen, the #1 new york times bestselling author of rise and shine, blessings, and a short guide to a happy life still life with bread crumbs begins with an imagined gunshot and ends with a new tin roof. between the two is a wry and knowing portrait of rebecca winter, a photographer whose work made her an unlikely heroine for many women. her a superb love story from anna quindlen, the #1 new york times bestselling author of rise and shine, blessings, and a short guide to a happy life still life with bread crumbs begins with an imagined gunshot and ends with a new tin roof. between the two is a wry and knowing portrait of.",26.41,3,In stock
265,Livro,Sorting the Beef from the Bull: The Science of Food Fraud Forensics,science,"Horse meat in our burgers, melamine in our infant formula, artificial colors in our fish and fruit--as our urban lifestyle takes us farther away from our food sources, there are increasing opportunities for dishonesty, duplicity, and profit-making shortcuts. food adulteration, motivated by money, is an issue that has spanned the globe throughout human history. whether it's horse meat in our burgers, melamine in our infant formula, artificial colors in our fish and fruit--as our urban lifestyle takes us farther away from our food sources, there are increasing opportunities for dishonesty, duplicity, and profit-making shortcuts. food adulteration, motivated by money, is an issue that has spanned the globe throughout human history. whether it's a matter of making a good quality oil stretch a bit further by adding a little extra ""something"" or labeling a food falsely to appeal to.",44.74,4,In stock
266,Livro,Someone Like You (The Harrisons #2),contemporary,"Pierce harrison--yes, that pierce harrison, black sheep of the wealthy harrison clan--has come home to his family's luxurious long island compound. the big question is why the dangerously sexy soccer star agreed to coach a kids' soccer team. his co-coach abby mccord should be grateful. instead she's fending off some seriously smoldering advances from the scandal-ridden ath pierce harrison--yes, that pierce harrison, black sheep of the wealthy harrison clan--has come home to his family's luxurious long island compound. the big question is why the dangerously sexy soccer star agreed to coach a kids' soccer team. his co-coach abby mccord should.",52.79,5,In stock
267,Livro,"So Cute It Hurts!!, Vol. 6 (So Cute It Hurts!! #6)",sequential art,"The kobayashi twins, megumu and mitsuru, were named after historical figures, but only megumu has grown up with a taste for history. so when mitsuru is in danger of losing his weekends to extra history classes, he convinces his sister to swap clothes with him and ace his tests! after all, how hard can it be for them to play each other?megumu is considering a career as a ma the kobayashi twins, megumu and mitsuru, were named after historical figures, but only megumu has grown up with a taste for history. so when mitsuru is in danger of losing his weekends to extra history classes,.",35.43,4,In stock
268,Livro,Shtum,fiction,"Powerful, darkly funny and heart-breaking, shtum is a story about fathers and sons, autism, and dysfunctional relationships.ben jewell has hit breaking point. his ten-year-old son jonah has severe autism and ben and his wife, emma, are struggling to cope.when ben and emma fake a separation - a strategic decision to further jonah's case in an upcoming tribunal - ben and jon powerful, darkly funny and heart-breaking, shtum is a story about fathers and sons, autism, and dysfunctional relationships.ben jewell has hit breaking point. his ten-year-old son jonah has severe.",55.84,4,In stock
269,Livro,See America: A Celebration of Our National Parks & Treasured Sites,travel,"To coincide with the 2016 centennial anniversary of the national parks service, the creative action network has partnered with the national parks conservation association to revive and reimagine the legacy of wpa travel posters. artists from all over the world have participated in the creation of this new, crowdsourced collection of see america posters for a modern era. fe to coincide with the 2016 centennial anniversary of the national parks service, the.",48.87,3,In stock
270,Livro,salt.,poetry,Salt is a journey through warmth and sharpness. this collection of poetry explores the realities.,46.78,4,In stock
271,Livro,Robin War,sequential art,"It’s robins vs. cops! robins vs. robins! robins vs. batman! robins vs. the court of owls‽collecting: robin war 1-2, grayson 15,.",47.82,3,In stock
272,Livro,"Red Hood/Arsenal, Vol. 1: Open for Business (Red Hood/Arsenal #1)",sequential art,"Red hood and arsenal are open for business! after working for the mysterious tara battleworth as on-staff outlaws, roy and jason have decided to branch out on their own as freelance problem solvers, investigators, and general butt-kicking specialists. but when the sinister corporate scourge of underbelly rears its ugly head, can our heroes overcome pure evil and corruption red hood and.",25.48,2,In stock
273,Livro,Rain Fish,childrens,"Get to know the “rain fish” that come to life during rainstorms in this gorgeous exploration of nature with vibrant collage artwork from the caldecott honor–winning illustrator of chicka boom.when blue sky turns gray and it rains all day, sometimes rain fish come out and play. they swim among discards and debris. do you see them, too? or is it just me?through l get to know the “rain fish” that come to life during rainstorms in this gorgeous exploration of nature with vibrant collage artwork from the caldecott honor–winning illustrator of chicka boom.when blue sky turns gray and it rains all day, sometimes rain fish come out and play. they swim among discards and debris. do you see them, too?.",23.57,3,In stock
274,Livro,"Quarter Life Poetry: Poems for the Young, Broke and Hangry",poetry,"The creator of the popular tumblr and instagram ""quarter life poetry"" tackles the real-life truths of work, money, sex, and many other challenges 20-somethings face in a laugh-out-loud collection of poetry.samantha jayne knows that life post-college isn't as glamorous as all undergrads think it's going to be... because she's currently living it. a graphic artist, sam start the creator of the popular tumblr and instagram ""quarter life poetry"" tackles the real-life truths of work, money, sex, and many other challenges 20-somethings face in a laugh-out-loud collection of poetry.samantha jayne knows that life post-college isn't as glamorous as all undergrads think it's.",50.89,5,In stock
275,Livro,Pet Sematary,horror,"Sometimes dead is better....when the creeds move into a beautiful old house in rural maine, it all seems too good to be true: physician father, beautiful wife, charming little daughter, adorable infant son -- and now an idyllic home. as a family, they've got it all...right down to the friendly cat.but the nearby woods hide a blood-chilling truth -- more terrifying than dea sometimes dead.",10.56,3,In stock
276,Livro,"Overload: How to Unplug, Unwind, and Unleash Yourself from the Pressure of Stress",self help,"#1 new york times bestselling author joyce meyer shows readers how to become free from the burden of stress so that they can achieve god's best for their lives. as technology increases your accessibility, it becomes harder to mute the background noise of your life and receive god's guidance. joyce meyer calls this overload, when the demands of your busy life become all-con #1 new york times bestselling author joyce meyer shows readers how to become free from the burden of stress so that they can achieve god's best for their lives. as technology increases your accessibility, it becomes harder to mute the background noise of your.",52.15,3,In stock
277,Livro,Once Was a Time,childrens,"In the war-ravaged england of 1940, charlotte bromley is sure of only one thing: kitty mclaughlin is her best friend in the whole world. but when charlotte's scientist father makes an astonishing discovery that the germans will covet for themselves, charlotte is faced with an impossible choice between danger and safety. should she remain with her friend or journey to anoth in the war-ravaged england of 1940, charlotte bromley is sure of only one thing: kitty mclaughlin is her best friend in the whole world. but when charlotte's scientist father makes.",18.28,2,In stock
278,Livro,Old School (Diary of a Wimpy Kid #10),humor,"In the latest installment of the phenomenally bestselling diary of a wimpy kid series, author-illustrator jeff kinney brings the series back to its roots, as greg starts a new school year and faces a challenge he never could've imagined.",11.83,5,In stock
279,Livro,No Dream Is Too High: Life Lessons From a Man Who Walked on the Moon,nonfiction,"Beloved american hero buzz aldrin reflects on the wisdom, guiding principles, and irreverent anecdotes he's gathered through his event-filled life—both in outer space and on earth—in this inspiring guide-to-life for the next generation. everywhere he goes, crowds gather to meet buzz aldrin. he is a world-class hero, a larger-than-life figurehead, best known of a generatio beloved american hero buzz aldrin reflects on the wisdom, guiding principles, and irreverent anecdotes he's gathered through his event-filled life—both in outer space and on earth—in this inspiring guide-to-life for the next generation. everywhere he goes, crowds gather to meet buzz aldrin. he is a world-class hero, a larger-than-life figurehead, best known of a generation of astronauts whose achievements surged in just a few years from first man in space to first men on the moon. now he pauses to reflect and share what he has learned, from the vantage point not only of outer space but also of time: still a non-stop traveler and impassioned advocate for space exploration, aldrin will.",21.95,2,In stock
280,Livro,"Naruto (3-in-1 Edition), Vol. 14: Includes Vols. 40, 41 & 42 (Naruto: Omnibus #14)",sequential art,"Naruto is a young shinobi with an incorrigible knack for mischief. he’s got a wild sense of humor, but naruto is completely serious about his mission to be the world’s greatest ninja!it’s deidara vs. sasuke, but even deidara’s ultimate art may be no match for the all-powerful new sasuke. the battle culminates in a giant explosion, leaving members of team kakashi concerned, naruto is a young shinobi with an incorrigible knack for mischief. he’s got a wild sense of.",38.39,2,In stock
