ID_Produto,Produto,Titulo,Categoria,Descricao,Preco,Avaliacao,Disponibilidade
470,Livro,Living Forward: A Proven Plan to Stop Drifting and Get the Life You Want,nonfiction,"Each of us has but one life to live on this earth. what we do with it is our choice. are we drifting through it as spectators, reacting to our circumstances when necessary and wondering just how we got to this point anyway? or are we directing it, maximizing the joy and potential of every day, living with a purpose or mission in mind? too many of us are doing the former--a each of us has but one life to live on this earth. what we do with it is our choice. are we drifting through it as spectators, reacting to our circumstances when necessary and wondering just how we got to this point anyway? or are we directing it, maximizing the joy and potential of every day, living with a.",12.55,3,In stock
471,Livro,Les Fleurs du Mal,poetry,Presents the first american translation of the complete text of baudelaire's.,29.04,5,In stock
473,Livro,Kill 'Em and Leave: Searching for James Brown and the American Soul,music,"National book award winner james mcbride goes in search of the “real” james brown after receiving a tip that promises to uncover the man behind the myth. his surprising journey illuminates not only our understanding of this immensely troubled, misunderstood, and complicated soul genius but the ways in which our cultural heritage has been shaped by brown’s legacy. kill ’em national book award winner james mcbride goes in search of the “real” james brown after receiving a tip that promises to uncover the man behind the myth. his surprising journey illuminates not only our understanding of this immensely troubled, misunderstood, and complicated soul genius but the ways in which our cultural heritage has been shaped by brown’s legacy. kill ’em and leave is more than a book about james brown. brown’s rough-and-tumble life, through mcbride’s lens, is an unsettling metaphor for american life: the tension between north and south, black and white, rich and poor. mcbride’s travels take him to forgotten corners of brown’s never-before-revealed history: the country town where brown’s family and thousands of others were displaced by america’s largest nuclear power bomb-making facility; a south carolina field where a long-forgotten cousin recounts, in the dead of night, a fuller history of brown’s sharecropping childhood, which until now has been a mystery. mcbride seeks out the american expatriate in england who co-created the james brown sound, visits the trusted right-hand manager who worked with brown for forty-one years, and interviews brown’s most influential nonmusical creation, his “adopted son,” the reverend al sharpton. he describes the stirring visit of michael jackson to the augusta, georgia, funeral home where the king of pop sat up all night with the body of.",45.05,5,In stock
474,Livro,Kierkegaard: A Christian Missionary to Christians,philosophy,"Soren kierkegaard (1813-1855) had a mission. the church had become weak, flabby and inconsequential. being a christian was more a cultural heritage than a spiritual reality. his mission reintroduce the christian faith to christians. how could he break through to people who were members of the church and thought they were christians already? like an old testament prophet, k soren kierkegaard (1813-1855) had a mission. the church had become weak, flabby and inconsequential. being a christian was more a cultural heritage than a spiritual reality. his mission reintroduce the christian faith to christians. how could he break through to people who were members of the church and thought they were.",47.13,1,In stock
477,Livro,I Will Find You,nonfiction,"“this is it. my rape. i knew it was coming. every woman knows. and now here it is. my turn.” when joanna connors was thirty years old on assignment for the cleveland plain dealer to review a play at a college theater, she was held at knife point and raped by a stranger who had grown up five miles away from her. once her assailant was caught and sentenced, joanna never spo “this is it. my rape. i knew it was coming. every woman knows. and now here it is. my turn.” when joanna connors was thirty years old on assignment for the cleveland plain dealer to review a play at a college theater, she was held at knife point and raped by a stranger who had grown up five miles away from her. once her assailant was caught and sentenced, joanna never spoke.",44.21,1,In stock
478,Livro,Hystopia: A Novel,fiction,"By the early 1970s, president john f. kennedy has survived several assassination attempts and--martyred, heroic--is now in his third term. twenty-two-year-old eugene allen returns home from his tour of duty in vietnam and begins to write a war novel--a book echoing catch-22 and slaughterhouse-five--about veterans who have their battlefield experiences ""enfolded,"" wiped fro by the early 1970s, president john f. kennedy has survived several assassination attempts and--martyred, heroic--is now in his third term. twenty-two-year-old eugene allen returns home from his tour of duty in vietnam and begins to write a war novel--a book echoing catch-22 and slaughterhouse-five--about veterans who have their battlefield experiences ""enfolded,"" wiped from their memories through drugs and therapy. in eugene's fictive universe, veterans too damaged to be enfolded stalk the.",21.96,4,In stock
479,Livro,Howl and Other Poems,poetry,"The prophetic poem that launched a generation when it was first published in 1965 is here presented in a commemorative fortieth anniversary edition.when the book arrived from its british printers, it was seized almost immediately by u.s. customs, and shortly thereafter the san francisco police arrested its publisher and editor, lawrence ferlinghetti, together with city lig the prophetic poem that launched a generation when it was first published in 1965 is here presented in a commemorative fortieth anniversary edition.when the book arrived from its british printers, it was seized almost immediately by u.s. customs, and shortly thereafter.",40.45,2,In stock
480,Livro,History of Beauty,art,"Now in paperback, umberto eco’s groundbreaking and much-acclaimed first illustrated book has been a critical success since its first publication in 2004. what is beauty? umberto eco, among italy’s finest and most important contemporary thinkers, explores the nature, the meaning, and the very history of the idea of beauty in western culture. the profound and subtle text is now in paperback, umberto eco’s groundbreaking and much-acclaimed first illustrated book has been a critical success since its first publication in 2004. what is beauty? umberto eco,.",10.29,4,In stock
482,Livro,Future Shock (Future Shock #1),young adult,"What do you do when the future is too late, and the present is counting down to an inevitable moment?elena martinez has street smarts, the ability for perfect recall, and a deadline: if she doesn’t find a job before she turns eighteen, she’ll be homeless. but then she gets an unexpected offer from aether corporation, the powerful los angeles tech giant. along with four oth what do you do when the future is too late, and the present is counting down to an inevitable moment?elena martinez has street smarts, the ability for perfect recall, and a deadline: if she doesn’t find a job before she turns eighteen, she’ll be homeless. but then she gets an unexpected offer from aether corporation, the powerful los angeles tech giant. along with four other recruits—adam, chris,.",55.65,5,In stock
484,Livro,Diary of a Citizen Scientist: Chasing Tiger Beetles and Other New Ways of Engaging the World,science,"In the exploding world of citizen science, hundreds of thousands of volunteers are monitoring climate change, tracking bird migration, finding stardust for nasa, and excavating mastodons. the sheer number of citizen scientists, combined with new technology, has begun to shape how research is conducted. non-professionals become acknowledged experts: dentists turn into astro in the exploding world of citizen science, hundreds of thousands of volunteers are monitoring climate change, tracking bird migration, finding stardust for nasa, and excavating mastodons. the sheer number of citizen scientists, combined with new technology, has begun to shape how research is conducted. non-professionals become acknowledged experts: dentists turn into astronomers and accountants into botanists.diary of a citizen scientist is a timely exploration of this phenomenon, told through the lens of nature writer sharman apt russell’s yearlong study of a little-known species, the western red-bellied tiger beetle. in a voice both humorous and lyrical, russell recounts her persistent and joyful tracking of an.",28.41,1,In stock
486,Livro,Brilliant Beacons: A History of the American Lighthouse,history,"Set against the backdrop of an expanding nation,brilliant beaconstraces the evolution of america's lighthouse system from its earliest days, highlighting the political, military, and technological battles fought to illuminate the nation's hardscrabble coastlines. beginning with ""boston light,""america’s first lighthouse, dolin shows how the story of america, from colony to set against the backdrop of an expanding nation, brilliant beacons traces the evolution of america's lighthouse system from its earliest days, highlighting the political, military, and technological battles fought to illuminate the nation's hardscrabble coastlines. beginning with ""boston light,"" america’s first lighthouse, dolin shows how the story of america, from colony to regional backwater, to fledging nation, and eventually to global industrial power, can be illustrated through its lighthouses.even in the colonial era, the question of how best to solve the collective problem of lighting our ports, reefs, and coasts through a patchwork of private interests and independent localities telegraphed the great american debate over federalism and the role of a centralized government. as the nation expanded, throughout the nineteenth and early twentieth centuries, so too did the coastlines in need of illumination, from new england to the gulf of mexico, the great lakes, the pacific coast all the way to alaska. in dolin's hands we see.",11.45,3,In stock
487,Livro,Brazen: The Courage to Find the You That's Been Hiding,nonfiction,"There are so many moments in life when we choose to silence our intuition, abandon our own voice, and play small because we wonder, deep down: ""do i know who i really am? is who i really am enough?"" it's courageous work to learn to live from our essential identity--loved, worthy, whole. but what if god is calling us to shamelessly recover the woman he created us to be? wha there are so many moments in life when we choose to silence our intuition, abandon our own voice, and play small because we wonder, deep down: ""do i know who i really am? is who i really am enough?"" it's courageous work to learn to live from our essential identity--loved, worthy, whole. but what if god is calling us to.",19.22,2,In stock
488,Livro,Between the World and Me,nonfiction,"“this is your country, this is your world, this is your body, and you must find some way to live within the all of it.”in a profound work that pivots from the biggest questions about american history and ideals to the most intimate concerns of a father for his son, ta-nehisi coates offers a powerful new framework for understanding our nation’s history and current crisis. a “this is your country, this is your world, this is your body, and you must find some way to live within the all of it.”in a profound work that pivots from the biggest questions about american history and ideals to the most intimate concerns of a father for his son, ta-nehisi coates offers a powerful new framework for understanding our nation’s history and current crisis. americans have built an empire on the idea of “race,” a falsehood that damages us all but falls most heavily on the bodies of black women and men—bodies exploited through.",56.91,4,In stock
489,Livro,Being Mortal: Medicine and What Matters in the End,nonfiction,"In being mortal, bestselling author atul gawande tackles the hardest challenge of his profession: how medicine can not only improve life but also the process of its ending.medicine has triumphed in modern times, transforming birth, injury, and infectious disease from harrowing to manageable. but in the inevitable condition of aging and death, the goals of medicine seem too in being mortal, bestselling author atul gawande tackles the hardest challenge of his profession: how medicine can not only improve life but also the process of its ending.medicine has triumphed in modern times, transforming birth, injury, and infectious disease from harrowing to manageable. but in the inevitable condition of aging and death, the goals of medicine seem too frequently to run counter to the interest of the human spirit. nursing homes, preoccupied with safety,.",55.06,4,In stock
490,Livro,"A Murder Over a Girl: Justice, Gender, Junior High",nonfiction,"A psychologist's gripping, troubling, and moving exploration of the brutal murder of a possibly transgender middle school student by an eighth grade classmateon feb. 12, 2008, at e. o. green junior high in oxnard, ca, 14-year-old brandon mcinerney shot and killed his classmate, larry king, who had recently begun to call himself ""leticia"" and wear makeup and jewelry to scho a psychologist's gripping, troubling, and moving exploration of the brutal murder of a possibly transgender middle school student by an eighth grade classmateon feb. 12, 2008, at e. o. green junior high in oxnard, ca, 14-year-old brandon mcinerney shot and killed his classmate, larry king, who had recently begun to call himself ""leticia"" and wear makeup and jewelry to school.profoundly shaken by the news, and unsettled by media coverage that sidestepped the issues of.",13.2,3,In stock
491,Livro,32 Yolks,food and drink,"For readers of jacques pépin’s the apprentice and marcus samuelsson’s yes, chef, here is the coming-of-age story of a true french chef and international culinary icon. before he earned three michelin stars at le bernardin, won the james beard foundation award for outstanding chef, or became a regular guest judge on bravo’s top chef, and even before he knew how to make a pr for readers of jacques pépin’s the apprentice and marcus samuelsson’s yes, chef, here is the coming-of-age story of a true french chef and international culinary icon. before he earned.",53.63,2,In stock
492,Livro,"""Most Blessed of the Patriarchs"": Thomas Jefferson and the Empire of the Imagination",history,"Thomas jefferson is often portrayed as a hopelessly enigmatic figure—a riddle—a man so riven with contradictions that he is almost impossible to know. lauded as the most articulate voice of american freedom and equality, even as he held people—including his own family—in bondage, jefferson is variably described as a hypocrite, an atheist, or a simple-minded proponent of li thomas jefferson is often portrayed as a hopelessly enigmatic figure—a riddle—a man so riven with contradictions that he is almost impossible to know. lauded as the most articulate voice of american freedom and equality, even as he held people—including his own family—in bondage, jefferson is variably described as a hypocrite, an atheist, or a simple-minded proponent of limited government who expected all americans to be farmers forever.now, annette gordon-reed teams up with america's leading jefferson scholar, peter s. onuf, to present an absorbing and revealing character study that dispels the many clichés that have accrued over the years about our third president. challenging the widely prevalent belief that jefferson remains so opaque as to be unknowable, the authors—through their careful analysis, painstaking research, and vivid prose—create a portrait of jefferson, as he might have painted himself, one ""comprised of equal parts sun and shadow"" (jane kamensky).tracing jefferson's philosophical development from youth to old age, the authors explore what they call the ""empire"" of jefferson's imagination—an expansive state of mind born of.",44.48,5,In stock
493,Livro,You Are a Badass: How to Stop Doubting Your Greatness and Start Living an Awesome Life,self help,"Bestselling author, speaker, and success coach jen sincero cuts through the din of the self-help genre with her own verbal meat cleaver. full of blunt humor, sage advice, and the occasional swear word, you are a badass offers its readers new opportunities for growth through 35 chapters of exercises, suggestions, and hilariously inspiring stories.from ""fear is for suckers"" bestselling author, speaker, and success coach jen sincero cuts through the din of the self-help genre with her own verbal meat.",12.08,3,In stock
495,Livro,What Happened on Beale Street (Secrets of the South Mysteries #2),mystery,"What happened on beale street is an exciting addition to the secrets of the south mysteries from bestselling author mary ellis. these standalone, complex crime dramas follow a private investigator's quest to make the world a better place...solving one case at a time.a cryptic plea for help from a childhood friend sends cousins nate and nicki price from new orleans to memph what happened on beale street is an exciting addition to the secrets of the south mysteries from bestselling author mary ellis. these standalone, complex crime dramas follow a private investigator's quest to make the world a better place...solving one case at a time.a cryptic plea for help from a childhood friend sends cousins nate and nicki price from new orleans to memphis, the home of scrumptious.",25.37,5,In stock
496,Livro,Unreasonable Hope: Finding Faith in the God Who Brings Purpose to Your Pain,spirituality,"Where was god when ____? how could god allow ____? why? these are the questions that flood our hearts and minds when the unimaginable happens. when things go horribly wrong and the world seems to be unraveling, how do you believe in god s goodness? how do you cling to hope? chad veach directs readers away from cliched sunday school answers that fail to offer real comfort o where was god when ____? how could god allow ____? why? these are the questions that flood our hearts and minds when the unimaginable happens. when things go horribly wrong and the world seems to be unraveling, how do you.",46.33,2,In stock
497,Livro,Under the Tuscan Sun,travel,"A classic from the bestselling author of under magnoliafrances mayes—widely published poet, gourmet cook, and travel writer—opens the door to a wondrous new world when she buys and restores an abandoned villa in the spectacular tuscan countryside. in evocative language, she brings the reader along as she discovers the beauty and simplicity of life in italy. mayes also crea a classic from the bestselling author of under magnoliafrances mayes—widely published poet, gourmet cook, and travel writer—opens the door to a wondrous new world.",37.33,3,In stock
498,Livro,Toddlers Are A**holes: It's Not Your Fault,humor,"Toddler a**holery is a normal part of human development—not unlike puberty, except this stage involves throwing food on the floor and taking swings at people who pay your way in life. for parents of toddlers, it's a ""you better laugh so you don't cry"" period. bunmi laditan's hilarious, satirical guide to toddlerhood offers parents instant (and very welcome) comic relief—al toddler a**holery is a normal part of human development—not unlike puberty, except this stage involves throwing food on the floor and taking swings at people who pay your way in life. for parents of toddlers, it's a ""you better laugh so you don't cry"" period. bunmi laditan's hilarious, satirical guide to toddlerhood offers parents instant (and very welcome) comic relief—along with the very good news that ""it's not your fault."" chapters cover the cost of raising a toddler, feeding your toddler, potty-training, tantrums, how to manage the holidays, and ""how not to die.",25.55,1,In stock
500,Livro,The Whale,childrens,"A wordless epic sea adventurethere is a legend that a great spotted whale lives in the ocean, although a sighting fifty years ago was never corroborated. now two young whale watchers each set out to find the whale, one armed with sound-recording equipment, the other with a camera. when their boats collide, they pool their resources to capture incontrovertible proof that th a wordless epic sea adventurethere is a legend that a great spotted whale lives in the ocean, although a sighting fifty years ago was never corroborated. now two young whale.",35.96,4,In stock
501,Livro,The Story of Art,art,"This text is the 16th revised and updated edition of this introduction to art, from the earliest cave paintings to experimental art. eight new artists from the modern period have been introduced. they are: corot, kollwitz, nolde, de chirico, brancussi, magritte, nicolson and morandi. a sequence of new endings have been added, and the captions are now fuller, including the this text is the 16th revised and updated edition of this introduction to art, from the earliest cave paintings to experimental art.",41.14,4,In stock
502,Livro,The Origin of Species,science,"The publication of darwin’s the origin of species in 1859 marked a dramatic turning point in scientific thought. the volume had taken darwin more than twenty years to publish, in part because he envisioned the storm of controversy it was certain to unleash. indeed, selling out its first edition on its first day, the origin of species revolutionized science, philosophy, and the publication of darwin’s the origin of species in 1859 marked a dramatic turning point in scientific thought. the volume had taken darwin more than twenty years to publish, in part because he envisioned the storm of controversy it was certain to unleash. indeed, selling out its first edition on its first day,.",10.01,4,In stock
506,Livro,The Faith of Christopher Hitchens: The Restless Soul of the World's Most Notorious Atheist,biography,"“if everyone in the united states had the same qualities of loyalty and care and concern for others that larry taunton had, we'd be living in a much better society than we do.” ~ christopher hitchensat the time of his death, christopher hitchens was the most notorious atheist in the world. and yet, all was not as it seemed. “nobody is not a divided self, of course,” heonce “if everyone in the united states had the same qualities of loyalty and care and concern for others that larry taunton had, we'd be living in a much better society than we do.” ~ christopher hitchensat the time of his death, christopher hitchens was the most notorious atheist in the world. and yet, all was not as it seemed. “nobody is not a divided self, of course,” he once told an interviewer, “but i think it’s rather strong in my case.” hitchens was a man of many contradictions: a marxist in youth who longed for acceptance among the social elites; a peacenik who revered the military; a champion of the left who was nonetheless pro-life, pro-war-on-terror, and after 9/11 something of.",39.55,1,In stock
508,Livro,The Constant Princess (The Tudor Court #1),historical fiction,"""i am catalina, princess of spain, daughter of the two greatest monarchs the world has ever known...and i will be queen of england.""thus, bestselling author philippa gregory introduces one of her most unforgettable heroines: katherine of aragon. known to history as the queen who was pushed off her throne by anne boleyn, here is a katherine the world has forgotten: the ench ""i am catalina, princess of spain, daughter of the two greatest monarchs the world has ever known...and i will be queen of england.""thus, bestselling author philippa gregory introduces one of her most unforgettable heroines: katherine of aragon. known to history as the queen who was pushed off her throne by anne boleyn, here is a katherine the world has forgotten: the enchanting princess that all england loved. first married to henry viii's older.",16.62,3,In stock
509,Livro,The Bourne Identity (Jason Bourne #1),fiction,"Who is jason bourne? is he an assassin, a terrorist, a thief? why has he got four million dollars in a swiss bank account? why has someone tried to murder him?...jason bourne does not.",42.78,4,In stock
510,Livro,The Bachelor Girl's Guide to Murder (Herringford and Watts Mysteries #1),mystery,"In 1910 toronto, while other bachelor girls perfect their domestic skills and find husbands, two friends perfect their sleuthing skills and find a murderer.inspired by their fascination with all things sherlock holmes, best friends and flatmates merinda and jem launch a consulting detective business. the deaths of young irish women lead merinda and jem deeper into the mire in 1910 toronto, while other bachelor girls perfect their domestic skills and find husbands, two friends perfect their sleuthing skills and find a murderer.inspired by their fascination with all things sherlock holmes, best friends and flatmates merinda and jem launch a consulting detective business. the deaths of.",52.3,5,In stock
